{"schema_version":1,"id":"evt.hgy.meal_she_finishes","title_key":"event.hgy.meal_she_finishes.title","location_id":"loc.hakugyokurou","spot_id":"loc.hakugyokurou.dining_room","cast":["char.youmu_konpaku","char.yuyuko_saigyouji"],"availability":[{"predicate":"chapter_at_least","value":"chapter.1"},{"predicate":"event_completed","value":"evt.hgy.cutting_wrong_problem"},{"predicate":"flag_false","key":"evt.hgy.meal_she_finishes.complete"}],"entry_node":"n001","nodes":{"n001":{"type":"music_state","state":"mus_yuyuko_banquet","next":"n002"},"n002":{"type":"exploration_objective","objective_key":"obj.hgy.meal_she_finishes.sit","interactable_ids":["prop.hgy.cooling_soup","prop.hgy.yuyuko_garden_hat"],"next":"n003"},"n003":{"type":"line","beat_id":"beat.hgy.meal.yuyuko_offer","next":"n004"},"n004":{"type":"line","beat_id":"beat.hgy.meal.youmu_hesitate","next":"n005"},"n005":{"type":"choice","choice_id":"choice.hgy.meal.response","options":[{"tone":"direct","text_key":"choice.hgy.meal.direct","next":"n_direct"},{"tone":"playful","text_key":"choice.hgy.meal.playful","next":"n_playful"},{"tone":"patient","text_key":"choice.hgy.meal.patient","next":"n_patient"},{"tone":"defiant","text_key":"choice.hgy.meal.defiant","next":"n_defiant"}]},"n_direct":{"type":"effects","effects":[{"op":"relationship","character_id":"char.youmu_konpaku","facet":"respect","delta":1}],"next":"n_direct_line"},"n_playful":{"type":"effects","effects":[{"op":"relationship","character_id":"char.youmu_konpaku","facet":"spark","delta":1}],"next":"n_playful_line"},"n_patient":{"type":"effects","effects":[{"op":"relationship","character_id":"char.youmu_konpaku","facet":"ease","delta":1}],"next":"n_patient_line"},"n_defiant":{"type":"effects","effects":[{"op":"relationship","character_id":"char.youmu_konpaku","facet":"respect","delta":1},{"op":"relationship","character_id":"char.youmu_konpaku","facet":"strain","delta":1}],"next":"n_defiant_line"},"n_direct_line":{"type":"line","beat_id":"beat.hgy.meal.direct","next":"n_after"},"n_playful_line":{"type":"line","beat_id":"beat.hgy.meal.playful","next":"n_after"},"n_patient_line":{"type":"line","beat_id":"beat.hgy.meal.patient","next":"n_after"},"n_defiant_line":{"type":"line","beat_id":"beat.hgy.meal.defiant","next":"n_after"},"n_after":{"type":"line","beat_id":"beat.hgy.meal.after","next":"n_journal"},"n_journal":{"type":"journal_entry","entry_id":"journal.hgy.meal_she_finishes","entry_type":"route_observation","tags":["meal_finished","duty_chosen","yuyuko_covers_watch"],"next":"n_effects"},"n_effects":{"type":"effects","effects":[{"op":"route_stage","character_id":"char.youmu_konpaku","stage":5},{"op":"set_flag","key":"flag.route.youmu.finished_meal","value":true},{"op":"set_flag","key":"evt.hgy.meal_she_finishes.complete","value":true}],"next":"n_end"},"n_end":{"type":"end_event","outcome":"meal_finished_without_abandoning_duty"}},"origin_tags":{"canon":3,"fanon":0,"original":10},"comfort_tags":["no_timer","rest_without_penalty","duty_remains_chosen"]}
