{"schema_version":1,"id":"evt.hgy.last_sweet","title_key":"event.hgy.last_sweet.title","location_id":"loc.hakugyokurou","spot_id":"loc.hakugyokurou.final_sweet_table","cast":["char.yuyuko_saigyouji","char.youmu_konpaku"],"availability":[{"predicate":"chapter_at_least","value":"chapter.1"},{"predicate":"event_completed","value":"evt.yyk.feast_without_ending"},{"predicate":"flag_false","key":"evt.hgy.last_sweet.complete"}],"entry_node":"n001","nodes":{"n001":{"type":"music_state","state":"mus_yuyuko_private","next":"n003"},"n002":{"type":"exploration_objective","objective_key":"obj.hgy.last_sweet.choose","interactable_ids":["prop.yyk.final_sweet","prop.yyk.story_invitation_card"],"next":"n005"},"n003":{"type":"line","beat_id":"beat.hgy.last_sweet.witness","next":"n004"},"n004":{"type":"line","beat_id":"beat.hgy.last_sweet.ask","next":"n002"},"n005":{"type":"choice","choice_id":"choice.hgy.last_sweet.promise.intent","options":[{"tone":"direct","text_key":"choice.hgy.last_sweet.friendship","next":"n_friendship"},{"tone":"playful","text_key":"choice.hgy.last_sweet.romance","next":"n_romance"},{"tone":"patient","text_key":"choice.hgy.last_sweet.postponed","next":"n_postponed"},{"tone":"defiant","text_key":"choice.hgy.last_sweet.undecided","next":"n_undecided"}]},"n_friendship":{"type":"line","beat_id":"beat.hgy.last_sweet.friendship","next":"n_journal_friendship"},"n_romance":{"type":"line","beat_id":"beat.hgy.last_sweet.romance","next":"n_romance_consent"},"n_postponed":{"type":"line","beat_id":"beat.hgy.last_sweet.postponed","next":"n_journal_postponed"},"n_undecided":{"type":"line","beat_id":"beat.hgy.last_sweet.undecided","next":"n_journal_undecided"},"n_romance_consent":{"type":"choice","choice_id":"choice.hgy.last_sweet.promise.romance_consent","options":[{"tone":"direct","text_key":"choice.hgy.last_sweet.romance_yes","next":"n_romance_approved"},{"tone":"defiant","text_key":"choice.hgy.last_sweet.romance_no","next":"n_romance_declined"}]},"n_romance_approved":{"type":"line","beat_id":"beat.hgy.last_sweet.romance_approved","next":"n_journal_romance"},"n_romance_declined":{"type":"line","beat_id":"beat.hgy.last_sweet.romance_declined","next":"n_journal_romance_declined"},"n_journal_friendship":{"type":"journal_entry","entry_id":"journal.hgy.last_sweet.promise.friendship","entry_type":"route_observation","tags":["standing_story_invitation","friendship_not_consolation"],"next":"n_effects_friendship"},"n_journal_romance":{"type":"journal_entry","entry_id":"journal.hgy.last_sweet.promise.romance","entry_type":"route_observation","tags":["final_sweet_saved","consent_affirmed","finite_gift"],"next":"n_effects_romance"},"n_journal_romance_declined":{"type":"journal_entry","entry_id":"journal.hgy.last_sweet.promise.romance_declined","entry_type":"route_observation","tags":["sweet_declined","no_penalty","future_unclaimed"],"next":"n_effects_romance_declined"},"n_journal_postponed":{"type":"journal_entry","entry_id":"journal.hgy.last_sweet.promise.postponed","entry_type":"route_observation","tags":["label_postponed","sweet_not_debt"],"next":"n_effects_postponed"},"n_journal_undecided":{"type":"journal_entry","entry_id":"journal.hgy.last_sweet.promise.undecided","entry_type":"route_observation","tags":["future_unclaimed","last_bite_shared_by_table"],"next":"n_effects_undecided"},"n_effects_friendship":{"type":"effects","effects":[{"op":"route_intent","character_id":"char.yuyuko_saigyouji","intent":"friendship"},{"op":"route_stage","character_id":"char.yuyuko_saigyouji","stage":7},{"op":"set_flag","key":"flag.route.yuyuko.promise.friendship","value":true},{"op":"set_flag","key":"evt.hgy.last_sweet.complete","value":true}],"next":"n_end_friendship"},"n_effects_romance":{"type":"effects","effects":[{"op":"route_intent","character_id":"char.yuyuko_saigyouji","intent":"romance"},{"op":"route_stage","character_id":"char.yuyuko_saigyouji","stage":7},{"op":"set_flag","key":"flag.route.yuyuko.promise.final_sweet_consent_affirmed","value":true},{"op":"set_flag","key":"evt.hgy.last_sweet.complete","value":true}],"next":"n_end_romance"},"n_effects_romance_declined":{"type":"effects","effects":[{"op":"route_intent","character_id":"char.yuyuko_saigyouji","intent":"undecided"},{"op":"route_stage","character_id":"char.yuyuko_saigyouji","stage":7},{"op":"set_flag","key":"flag.route.yuyuko.promise.final_sweet_declined_without_penalty","value":true},{"op":"set_flag","key":"evt.hgy.last_sweet.complete","value":true}],"next":"n_end_romance_declined"},"n_effects_postponed":{"type":"effects","effects":[{"op":"route_intent","character_id":"char.yuyuko_saigyouji","intent":"postponed"},{"op":"route_stage","character_id":"char.yuyuko_saigyouji","stage":7},{"op":"set_flag","key":"flag.route.yuyuko.promise.postponed_without_food_debt","value":true},{"op":"set_flag","key":"evt.hgy.last_sweet.complete","value":true}],"next":"n_end_postponed"},"n_effects_undecided":{"type":"effects","effects":[{"op":"route_intent","character_id":"char.yuyuko_saigyouji","intent":"undecided"},{"op":"route_stage","character_id":"char.yuyuko_saigyouji","stage":7},{"op":"set_flag","key":"flag.route.yuyuko.promise.undecided_unclaimed","value":true},{"op":"set_flag","key":"evt.hgy.last_sweet.complete","value":true}],"next":"n_end_undecided"},"n_end_friendship":{"type":"end_event","outcome":"hungry_guest_with_story_friendship"},"n_end_romance":{"type":"end_event","outcome":"final_sweet_accepted_as_finite_romance"},"n_end_romance_declined":{"type":"end_event","outcome":"final_sweet_declined_future_unclaimed"},"n_end_postponed":{"type":"end_event","outcome":"relationship_postponed_sweet_finished_without_debt"},"n_end_undecided":{"type":"end_event","outcome":"future_unclaimed_last_bite_shared"}},"origin_tags":{"canon":3,"fanon":1,"original":11},"comfort_tags":["no_timer","no_failure","route_intent_explicit","interactive_romance_consent"]}
