{"schema_version":1,"id":"evt.mrs.infinite_experiment","title_key":"event.mrs.infinite_experiment.title","location_id":"loc.forest_of_magic","spot_id":"loc.forest_of_magic.mushroom_field","cast":["char.marisa_kirisame","char.reimu_hakurei"],"availability":[{"predicate":"chapter_at_least","value":"chapter.1"},{"predicate":"event_completed","value":"evt.mrs.rescue_looks_like_race"},{"predicate":"flag_false","key":"evt.mrs.infinite_experiment.complete"}],"entry_node":"n001","nodes":{"n001":{"type":"music_state","state":"mus_marisa_night","next":"n002"},"n002":{"type":"exploration_objective","objective_key":"obj.mrs.archive.leave_copy","interactable_ids":["prop.archive_failure_copy","prop.marisa_field_notes"],"next":"n003"},"n003":{"type":"line","beat_id":"beat.mrs.archive.offer","next":"n004"},"n004":{"type":"line","beat_id":"beat.mrs.archive.refusal","next":"n005"},"n005":{"type":"choice","choice_id":"choice.mrs.archive.answer","options":[{"tone":"direct","text_key":"choice.mrs.archive.direct","next":"n_direct"},{"tone":"playful","text_key":"choice.mrs.archive.playful","next":"n_playful"},{"tone":"patient","text_key":"choice.mrs.archive.patient","next":"n_patient"},{"tone":"defiant","text_key":"choice.mrs.archive.defiant","next":"n_defiant"}]},"n_direct":{"type":"effects","effects":[{"op":"relationship","character_id":"char.marisa_kirisame","facet":"respect","delta":1}],"next":"n_direct_line"},"n_playful":{"type":"effects","effects":[{"op":"relationship","character_id":"char.marisa_kirisame","facet":"spark","delta":1}],"next":"n_playful_line"},"n_patient":{"type":"effects","effects":[{"op":"relationship","character_id":"char.marisa_kirisame","facet":"ease","delta":1}],"next":"n_patient_line"},"n_defiant":{"type":"effects","effects":[{"op":"relationship","character_id":"char.marisa_kirisame","facet":"respect","delta":1},{"op":"relationship","character_id":"char.marisa_kirisame","facet":"strain","delta":1}],"next":"n_defiant_line"},"n_direct_line":{"type":"line","beat_id":"beat.mrs.archive.direct","next":"n_after"},"n_playful_line":{"type":"line","beat_id":"beat.mrs.archive.playful","next":"n_after"},"n_patient_line":{"type":"line","beat_id":"beat.mrs.archive.patient","next":"n_after"},"n_defiant_line":{"type":"line","beat_id":"beat.mrs.archive.defiant","next":"n_after"},"n_after":{"type":"line","beat_id":"beat.mrs.archive.after","next":"n_journal"},"n_journal":{"type":"journal_entry","entry_id":"journal.mrs.infinite_experiment","entry_type":"route_observation","tags":["archive_refusal","next_attempt_owned","failure_not_replaced"],"next":"n_effects"},"n_effects":{"type":"effects","effects":[{"op":"route_stage","character_id":"char.marisa_kirisame","stage":6},{"op":"set_flag","key":"flag.route.marisa.archive.refused_perfect_recall","value":true},{"op":"set_flag","key":"evt.mrs.infinite_experiment.complete","value":true}],"next":"n_end"},"n_end":{"type":"end_event","outcome":"next_attempt_left_unowned_by_archive"}},"origin_tags":{"canon":2,"fanon":0,"original":10},"comfort_tags":["no_timer","archive_refusal","no_route_lockout"]}
