{"schema_version":1,"id":"evt.tsh.keystone_construction","title_key":"event.tsh.keystone_construction.title","location_id":"loc.heaven","spot_id":"loc.heaven.keystone_span_worksite","cast":["char.tenshi_hinanawi","char.iku_nagae"],"availability":[{"predicate":"chapter_at_least","value":"chapter.1"},{"predicate":"event_completed","value":"evt.tsh.entrance_tremor"},{"predicate":"flag_false","key":"evt.tsh.keystone_construction.complete"}],"entry_node":"n001","nodes":{"n001":{"type":"music_state","state":"mus_tenshi_route","next":"n_plan"},"n_plan":{"type":"line","beat_id":"beat.tsh.keystone_construction.plan","next":"n_iku"},"n_iku":{"type":"line","beat_id":"beat.tsh.keystone_construction.iku_constraint","next":"n_objective"},"n_objective":{"type":"exploration_objective","objective_key":"obj.tsh.keystone_construction.read","interactable_ids":["prop.tsh.three_anchor_slots","prop.tsh.plumb_line_weather_card","prop.tsh.unnarrowed_cloud_lane"],"next":"n_choice"},"n_choice":{"type":"choice","choice_id":"choice.tsh.keystone_construction.response","options":[{"tone":"direct","text_key":"choice.tsh.keystone_construction.direct","next":"n_direct"},{"tone":"playful","text_key":"choice.tsh.keystone_construction.playful","next":"n_playful"},{"tone":"patient","text_key":"choice.tsh.keystone_construction.patient","next":"n_patient"},{"tone":"defiant","text_key":"choice.tsh.keystone_construction.defiant","next":"n_defiant"}]},"n_direct":{"type":"effects","effects":[{"op":"relationship","character_id":"char.tenshi_hinanawi","facet":"respect","delta":1},{"op":"set_flag","key":"flag.route.tenshi.keystone.load_path_named","value":true}],"next":"n_direct_line"},"n_playful":{"type":"effects","effects":[{"op":"relationship","character_id":"char.tenshi_hinanawi","facet":"spark","delta":1},{"op":"set_flag","key":"flag.route.tenshi.keystone.monument_joke_refused","value":true}],"next":"n_playful_line"},"n_patient":{"type":"effects","effects":[{"op":"relationship","character_id":"char.tenshi_hinanawi","facet":"trust","delta":1},{"op":"set_flag","key":"flag.route.tenshi.keystone.weather_constraint_heard","value":true}],"next":"n_patient_line"},"n_defiant":{"type":"effects","effects":[{"op":"relationship","character_id":"char.tenshi_hinanawi","facet":"respect","delta":1},{"op":"set_flag","key":"flag.route.tenshi.keystone.passersby_space_protected","value":true}],"next":"n_defiant_line"},"n_direct_line":{"type":"line","beat_id":"beat.tsh.keystone_construction.direct","next":"n_build"},"n_playful_line":{"type":"line","beat_id":"beat.tsh.keystone_construction.playful","next":"n_build"},"n_patient_line":{"type":"line","beat_id":"beat.tsh.keystone_construction.patient","next":"n_build"},"n_defiant_line":{"type":"line","beat_id":"beat.tsh.keystone_construction.defiant","next":"n_build"},"n_build":{"type":"start_minigame","minigame_id":"mini.tsh.keystone_construction","context":{"target_band":"three_anchors_safe_load_and_open_lane","assist_allowed":true,"underbuild_and_overbuild_are_safe_resets":true},"result_branches":{"clear":"n_clear","assist_clear":"n_assist","loss":"n_loss"}},"n_clear":{"type":"line","beat_id":"beat.tsh.keystone_construction.clear","next":"n_after"},"n_assist":{"type":"line","beat_id":"beat.tsh.keystone_construction.assist","next":"n_after"},"n_loss":{"type":"line","beat_id":"beat.tsh.keystone_construction.loss","next":"n_after"},"n_after":{"type":"line","beat_id":"beat.tsh.keystone_construction.after","next":"n_journal"},"n_journal":{"type":"journal_entry","entry_id":"journal.tsh.keystone_construction","entry_type":"route_observation","tags":["competence_not_spectacle","underbuild_overbuild_reset_safely","open_lane_preserved","loss_continues"],"next":"n_effects"},"n_effects":{"type":"effects","effects":[{"op":"route_stage","character_id":"char.tenshi_hinanawi","stage":2},{"op":"set_flag","key":"flag.route.tenshi.keystone.safe_span_completed","value":true},{"op":"set_flag","key":"flag.route.tenshi.keystone.open_lane_preserved","value":true},{"op":"set_flag","key":"flag.route.tenshi.keystone.competence_not_audience_score","value":true},{"op":"set_flag","key":"evt.tsh.keystone_construction.complete","value":true}],"next":"n_end"},"n_end":{"type":"end_event","outcome":"keystone_span_stable_without_monument_or_bottleneck"}},"origin_tags":{"canon":3,"fanon":1,"original":14},"comfort_tags":["no_timer","assist_available","loss_continues","engineering_without_real_world_instruction","overbuild_not_rewarded"]}
