{"schema_version":1,"id":"evt.eir.practical_care","title_key":"event.eir.practical_care.title","location_id":"loc.eientei","spot_id":"loc.eientei.practical_care_table","cast":["char.eirin_yagokoro","char.kaguya_houraisan","char.kosuzu_motoori"],"availability":[{"predicate":"chapter_at_least","value":"chapter.1"},{"predicate":"event_completed","value":"evt.ein.patient_refuses"},{"predicate":"flag_false","key":"evt.eir.practical_care.complete"}],"entry_node":"n001","nodes":{"n001":{"type":"music_state","state":"mus_eirin_route","next":"n003"},"n003":{"type":"line","beat_id":"beat.eir.practical_care.kaguya_chart","next":"n004"},"n004":{"type":"line","beat_id":"beat.eir.practical_care.kosuzu_cut","next":"n005"},"n005":{"type":"line","beat_id":"beat.eir.practical_care.eirin_consent","next":"n_offer"},"n_offer":{"type":"line","beat_id":"beat.eir.practical_care.eirin_offer","next":"n_scope"},"n_scope":{"type":"line","beat_id":"beat.eir.practical_care.kosuzu_scope","next":"n002"},"n002":{"type":"exploration_objective","objective_key":"obj.eir.practical_care.balance","interactable_ids":["prop.eir.centuries_orbit_chart","prop.eir.kosuzu_return_slips","prop.eir.consent_bounded_care_packet"],"next":"n_choice"},"n_choice":{"type":"choice","choice_id":"choice.eir.practical_care.response","options":[{"tone":"direct","text_key":"choice.eir.practical_care.direct","next":"n_direct"},{"tone":"playful","text_key":"choice.eir.practical_care.playful","next":"n_playful"},{"tone":"patient","text_key":"choice.eir.practical_care.patient","next":"n_patient"},{"tone":"defiant","text_key":"choice.eir.practical_care.defiant","next":"n_defiant"}]},"n_direct":{"type":"effects","effects":[{"op":"relationship","character_id":"char.eirin_yagokoro","facet":"respect","delta":1},{"op":"set_flag","key":"flag.route.eirin.practical_care.next_task_asked","value":true}],"next":"n_direct_line"},"n_playful":{"type":"effects","effects":[{"op":"relationship","character_id":"char.eirin_yagokoro","facet":"spark","delta":1},{"op":"set_flag","key":"flag.route.eirin.practical_care.moon_can_wait_six_minutes","value":true}],"next":"n_playful_line"},"n_patient":{"type":"effects","effects":[{"op":"relationship","character_id":"char.eirin_yagokoro","facet":"trust","delta":1},{"op":"set_flag","key":"flag.route.eirin.practical_care.changed_task_heard_first","value":true}],"next":"n_patient_line"},"n_defiant":{"type":"effects","effects":[{"op":"relationship","character_id":"char.eirin_yagokoro","facet":"respect","delta":1},{"op":"set_flag","key":"flag.route.eirin.practical_care.scale_not_worth","value":true}],"next":"n_defiant_line"},"n_direct_line":{"type":"line","beat_id":"beat.eir.practical_care.direct","next":"n_plan"},"n_playful_line":{"type":"line","beat_id":"beat.eir.practical_care.playful","next":"n_plan"},"n_patient_line":{"type":"line","beat_id":"beat.eir.practical_care.patient","next":"n_plan"},"n_defiant_line":{"type":"line","beat_id":"beat.eir.practical_care.defiant","next":"n_plan"},"n_plan":{"type":"start_minigame","minigame_id":"mini.eir.practical_care_attention","context":{"target_band":"consent_next_task_cosmic_evidence_all_retained","assist_allowed":true,"no_real_world_treatment_steps":true},"result_branches":{"clear":"n_clear","assist_clear":"n_assist","loss":"n_loss"}},"n_clear":{"type":"line","beat_id":"beat.eir.practical_care.clear","next":"n_after"},"n_assist":{"type":"line","beat_id":"beat.eir.practical_care.assist","next":"n_after"},"n_loss":{"type":"line","beat_id":"beat.eir.practical_care.loss","next":"n_after"},"n_after":{"type":"line","beat_id":"beat.eir.practical_care.after","next":"n_journal"},"n_journal":{"type":"journal_entry","entry_id":"journal.eir.practical_care","entry_type":"route_observation","tags":["kosuzu_consent_preserved","care_scope_confirmed_separately","small_injury_full_attention","scale_not_worth","cosmic_error_still_reviewed","loss_continues"],"next":"n_effects"},"n_effects":{"type":"effects","effects":[{"op":"route_stage","character_id":"char.eirin_yagokoro","stage":3},{"op":"set_flag","key":"flag.route.eirin.practical_care.kosuzu_consent_preserved","value":true},{"op":"set_flag","key":"flag.route.eirin.practical_care.kosuzu_care_scope_confirmed","value":true},{"op":"set_flag","key":"flag.route.eirin.practical_care.scale_not_worth","value":true},{"op":"set_flag","key":"flag.route.eirin.practical_care.cosmic_problem_still_reviewed","value":true},{"op":"set_flag","key":"evt.eir.practical_care.complete","value":true}],"next":"n_end"},"n_end":{"type":"end_event","outcome":"small_human_care_and_cosmic_review_both_receive_exact_attention"}},"origin_tags":{"canon":3,"fanon":0,"original":14},"comfort_tags":["no_timer","assist_available","loss_continues","medical_consent","scale_not_worth","no_real_world_treatment_advice"]}
