{"schema_version":1,"id":"evt.tsh.attention_not_permission","title_key":"event.tsh.attention_not_permission.title","location_id":"loc.heaven","spot_id":"loc.heaven.boundary_stone_exit","cast":["char.tenshi_hinanawi"],"availability":[{"predicate":"chapter_at_least","value":"chapter.1"},{"predicate":"event_completed","value":"evt.tsh.imperfect_meal"},{"predicate":"flag_false","key":"evt.tsh.attention_not_permission.complete"}],"entry_node":"n001","nodes":{"n001":{"type":"music_state","state":"mus_tenshi_route","next":"n_break"},"n_break":{"type":"line","beat_id":"beat.tsh.attention_not_permission.break","next":"n_cost"},"n_cost":{"type":"line","beat_id":"beat.tsh.attention_not_permission.cost","next":"n_objective"},"n_objective":{"type":"exploration_objective","objective_key":"obj.tsh.attention_not_permission.inspect","interactable_ids":["prop.tsh.rebroken_boundary_stone","prop.tsh.closed_practice_arena","prop.tsh.clear_cloud_exit"],"next":"n_strain"},"n_strain":{"type":"effects","effects":[{"op":"relationship","character_id":"char.tenshi_hinanawi","facet":"strain","delta":1},{"op":"set_flag","key":"flag.route.tenshi.boundary.unasked_damage_made","value":true}],"next":"n_choice"},"n_choice":{"type":"choice","choice_id":"choice.tsh.attention_not_permission.response","options":[{"tone":"direct","text_key":"choice.tsh.attention_not_permission.direct","next":"n_direct"},{"tone":"playful","text_key":"choice.tsh.attention_not_permission.playful","next":"n_playful"},{"tone":"patient","text_key":"choice.tsh.attention_not_permission.patient","next":"n_patient"},{"tone":"defiant","text_key":"choice.tsh.attention_not_permission.defiant","next":"n_defiant"}]},"n_direct":{"type":"effects","effects":[{"op":"set_flag","key":"flag.route.tenshi.boundary.clear_no_spoken","value":true}],"next":"n_direct_line"},"n_playful":{"type":"effects","effects":[{"op":"set_flag","key":"flag.route.tenshi.boundary.clear_no_spoken","value":true}],"next":"n_playful_line"},"n_patient":{"type":"effects","effects":[{"op":"set_flag","key":"flag.route.tenshi.boundary.clear_no_spoken","value":true}],"next":"n_patient_line"},"n_defiant":{"type":"effects","effects":[{"op":"set_flag","key":"flag.route.tenshi.boundary.clear_no_spoken","value":true}],"next":"n_defiant_line"},"n_direct_line":{"type":"line","beat_id":"beat.tsh.attention_not_permission.direct","next":"n_leave"},"n_playful_line":{"type":"line","beat_id":"beat.tsh.attention_not_permission.playful","next":"n_leave"},"n_patient_line":{"type":"line","beat_id":"beat.tsh.attention_not_permission.patient","next":"n_leave"},"n_defiant_line":{"type":"line","beat_id":"beat.tsh.attention_not_permission.defiant","next":"n_leave"},"n_leave":{"type":"line","beat_id":"beat.tsh.attention_not_permission.leave","next":"n_leave_effects"},"n_leave_effects":{"type":"effects","effects":[{"op":"set_flag","key":"flag.route.tenshi.boundary.player_left_engagement","value":true}],"next":"n_respect"},"n_respect":{"type":"line","beat_id":"beat.tsh.attention_not_permission.respect","next":"n_journal"},"n_journal":{"type":"journal_entry","entry_id":"journal.tsh.attention_not_permission","entry_type":"route_observation","tags":["clear_no","player_leaves","tenshi_stops","strain_remains","no_romance_advance"],"next":"n_effects"},"n_effects":{"type":"effects","effects":[{"op":"route_stage","character_id":"char.tenshi_hinanawi","stage":4},{"op":"set_flag","key":"flag.route.tenshi.boundary.tenshi_stopped_without_escalation","value":true},{"op":"set_flag","key":"flag.route.tenshi.boundary.attention_not_permission","value":true},{"op":"set_flag","key":"evt.tsh.attention_not_permission.complete","value":true}],"next":"n_end"},"n_end":{"type":"end_event","outcome":"clear_no_followed_by_departure_and_respected_without_escalation"}},"origin_tags":{"canon":3,"fanon":1,"original":16},"comfort_tags":["no_timer","no_failure","clear_no_required","player_leaves","conflict_continues","no_punishment_framing","no_romance_advance"]}
