{"schema_version":1,"id":"evt.hgy.farewell_will_not_fall","title_key":"event.hgy.farewell_will_not_fall.title","location_id":"loc.hakugyokurou","spot_id":"loc.hakugyokurou.falling_petal_court","cast":["char.youmu_konpaku"],"availability":[{"predicate":"chapter_at_least","value":"chapter.1"},{"predicate":"event_completed","value":"evt.hgy.meal_she_finishes"},{"predicate":"flag_false","key":"evt.hgy.farewell_will_not_fall.complete"}],"entry_node":"n001","nodes":{"n001":{"type":"music_state","state":"mus_youmu_training","next":"n002"},"n002":{"type":"exploration_objective","objective_key":"obj.hgy.farewell.release","interactable_ids":["prop.archive_still_petal","prop.archive_waiting_spirit"],"next":"n003"},"n003":{"type":"line","beat_id":"beat.hgy.farewell.offer","next":"n004"},"n004":{"type":"line","beat_id":"beat.hgy.farewell.refusal","next":"n005"},"n005":{"type":"choice","choice_id":"choice.hgy.farewell.response","options":[{"tone":"direct","text_key":"choice.hgy.farewell.direct","next":"n_direct"},{"tone":"playful","text_key":"choice.hgy.farewell.playful","next":"n_playful"},{"tone":"patient","text_key":"choice.hgy.farewell.patient","next":"n_patient"},{"tone":"defiant","text_key":"choice.hgy.farewell.defiant","next":"n_defiant"}]},"n_direct":{"type":"effects","effects":[{"op":"relationship","character_id":"char.youmu_konpaku","facet":"respect","delta":1}],"next":"n_direct_line"},"n_playful":{"type":"effects","effects":[{"op":"relationship","character_id":"char.youmu_konpaku","facet":"spark","delta":1}],"next":"n_playful_line"},"n_patient":{"type":"effects","effects":[{"op":"relationship","character_id":"char.youmu_konpaku","facet":"ease","delta":1}],"next":"n_patient_line"},"n_defiant":{"type":"effects","effects":[{"op":"relationship","character_id":"char.youmu_konpaku","facet":"respect","delta":1},{"op":"relationship","character_id":"char.youmu_konpaku","facet":"strain","delta":1}],"next":"n_defiant_line"},"n_direct_line":{"type":"line","beat_id":"beat.hgy.farewell.direct","next":"n_after"},"n_playful_line":{"type":"line","beat_id":"beat.hgy.farewell.playful","next":"n_after"},"n_patient_line":{"type":"line","beat_id":"beat.hgy.farewell.patient","next":"n_after"},"n_defiant_line":{"type":"line","beat_id":"beat.hgy.farewell.defiant","next":"n_after"},"n_after":{"type":"line","beat_id":"beat.hgy.farewell.after","next":"n_journal"},"n_journal":{"type":"journal_entry","entry_id":"journal.hgy.farewell_will_not_fall","entry_type":"route_observation","tags":["archive_refusal","guarded_ending","petal_lands"],"next":"n_effects"},"n_effects":{"type":"effects","effects":[{"op":"route_stage","character_id":"char.youmu_konpaku","stage":6},{"op":"set_flag","key":"flag.route.youmu.guards_endings","value":true},{"op":"set_flag","key":"evt.hgy.farewell_will_not_fall.complete","value":true}],"next":"n_end"},"n_end":{"type":"end_event","outcome":"farewell_allowed_to_fall"}},"origin_tags":{"canon":3,"fanon":0,"original":10},"comfort_tags":["no_timer","archive_refusal","no_route_lockout"]}
