{"schema_version":1,"id":"evt.hkr.perfectly_recorded_tea","title_key":"event.hkr.perfectly_recorded_tea.title","location_id":"loc.hakurei_shrine","spot_id":"loc.hakurei_shrine.sitting_room","cast":["char.reimu_hakurei"],"availability":[{"predicate":"chapter_at_least","value":"chapter.1"},{"predicate":"event_completed","value":"evt.hkr.unasked_rescue"},{"predicate":"flag_false","key":"evt.hkr.perfectly_recorded_tea.complete"}],"entry_node":"n001","nodes":{"n001":{"type":"music_state","state":"mus_reimu_private","next":"n002"},"n002":{"type":"exploration_objective","objective_key":"obj.hkr.recorded_tea.set_cups","interactable_ids":["prop.second_cushion","prop.paper_screen","prop.shrine_broom"],"next":"n003"},"n003":{"type":"line","beat_id":"beat.hkr.recorded_tea.reimu.offer","next":"n004"},"n004":{"type":"line","beat_id":"beat.hkr.recorded_tea.reimu.refusal","next":"n005"},"n005":{"type":"choice","choice_id":"choice.hkr.recorded_tea.answer","options":[{"tone":"direct","text_key":"choice.hkr.recorded_tea.direct","next":"n_direct"},{"tone":"playful","text_key":"choice.hkr.recorded_tea.playful","next":"n_playful"},{"tone":"patient","text_key":"choice.hkr.recorded_tea.patient","next":"n_patient"},{"tone":"defiant","text_key":"choice.hkr.recorded_tea.defiant","next":"n_defiant"}]},"n_direct":{"type":"effects","effects":[{"op":"relationship","character_id":"char.reimu_hakurei","facet":"respect","delta":1},{"op":"set_flag","key":"flag.route.reimu.archive.refused_copy","value":true}],"next":"n_direct_line"},"n_playful":{"type":"effects","effects":[{"op":"relationship","character_id":"char.reimu_hakurei","facet":"spark","delta":1},{"op":"set_flag","key":"flag.route.reimu.archive.joked_about_perfection","value":true}],"next":"n_playful_line"},"n_patient":{"type":"effects","effects":[{"op":"relationship","character_id":"char.reimu_hakurei","facet":"ease","delta":1},{"op":"set_flag","key":"flag.route.reimu.archive.let_afternoon_end","value":true}],"next":"n_patient_line"},"n_defiant":{"type":"effects","effects":[{"op":"relationship","character_id":"char.reimu_hakurei","facet":"respect","delta":1},{"op":"relationship","character_id":"char.reimu_hakurei","facet":"strain","delta":1},{"op":"set_flag","key":"flag.route.reimu.archive.named_false_choice","value":true}],"next":"n_defiant_line"},"n_direct_line":{"type":"line","beat_id":"beat.hkr.recorded_tea.reimu.direct","next":"n006"},"n_playful_line":{"type":"line","beat_id":"beat.hkr.recorded_tea.reimu.playful","next":"n006"},"n_patient_line":{"type":"line","beat_id":"beat.hkr.recorded_tea.reimu.patient","next":"n006"},"n_defiant_line":{"type":"line","beat_id":"beat.hkr.recorded_tea.reimu.defiant","next":"n006"},"n006":{"type":"line","beat_id":"beat.hkr.recorded_tea.reimu.brew","next":"n_tea"},"n_tea":{"type":"start_minigame","minigame_id":"mini.shrine.tea_temperature","context":{"target_band":"warm","cups":2},"result_branches":{"excellent":"n_excellent","clear":"n_clear","loss":"n_loss"}},"n_excellent":{"type":"line","beat_id":"beat.hkr.recorded_tea.reimu.excellent","next":"n_after"},"n_clear":{"type":"line","beat_id":"beat.hkr.recorded_tea.reimu.clear","next":"n_after"},"n_loss":{"type":"line","beat_id":"beat.hkr.recorded_tea.reimu.loss","next":"n_after"},"n_after":{"type":"line","beat_id":"beat.hkr.recorded_tea.reimu.after","next":"n_journal"},"n_journal":{"type":"journal_entry","entry_id":"journal.hkr.perfectly_recorded_tea","entry_type":"route_observation","tags":["archive_refusal","finite_afternoon","tea_cools"],"next":"n_effects"},"n_effects":{"type":"effects","effects":[{"op":"route_stage","character_id":"char.reimu_hakurei","stage":5},{"op":"set_flag","key":"flag.route.reimu.archive.finite_afternoon_chosen","value":true},{"op":"set_flag","key":"evt.hkr.perfectly_recorded_tea.complete","value":true}],"next":"n_end"},"n_end":{"type":"end_event","outcome":"afternoon_left_to_change"}},"origin_tags":{"canon":2,"fanon":0,"original":12},"comfort_tags":["no_timer","wide_target","loss_continues"]}
