{"schema_version":1,"id":"evt.ein.mokou_uninvited_honesty","title_key":"event.ein.mokou_uninvited_honesty.title","location_id":"loc.eientei","spot_id":"loc.eientei.smoke_clearing","cast":["char.kaguya_houraisan","char.fujiwara_no_mokou"],"availability":[{"predicate":"chapter_at_least","value":"chapter.1"},{"predicate":"event_completed","value":"evt.ein.short_lived_guest"},{"predicate":"flag_false","key":"evt.ein.mokou_uninvited_honesty.complete"}],"entry_node":"n001","nodes":{"n001":{"type":"music_state","state":"mus_kaguya_afterbeat","next":"n003"},"n002":{"type":"exploration_objective","objective_key":"obj.ein.mokou_uninvited_honesty.choose","interactable_ids":["prop.ein.singed_bamboo","prop.ein.unopened_tea_flask"],"next":"n005"},"n003":{"type":"line","beat_id":"beat.ein.mokou_uninvited_honesty.intro","next":"n004"},"n004":{"type":"line","beat_id":"beat.ein.mokou_uninvited_honesty.rivalry","next":"n002"},"n005":{"type":"choice","choice_id":"choice.ein.mokou_uninvited_honesty.response","options":[{"tone":"direct","text_key":"choice.ein.mokou_uninvited_honesty.direct","next":"n_direct"},{"tone":"playful","text_key":"choice.ein.mokou_uninvited_honesty.playful","next":"n_playful"},{"tone":"patient","text_key":"choice.ein.mokou_uninvited_honesty.patient","next":"n_patient"},{"tone":"defiant","text_key":"choice.ein.mokou_uninvited_honesty.defiant","next":"n_defiant"}]},"n_direct":{"type":"effects","effects":[{"op":"relationship","character_id":"char.kaguya_houraisan","facet":"respect","delta":1},{"op":"relationship","character_id":"char.fujiwara_no_mokou","facet":"ease","delta":1},{"op":"set_flag","key":"flag.route.kaguya.conduct_not_blessing","value":true}],"next":"n_direct_line"},"n_playful":{"type":"effects","effects":[{"op":"relationship","character_id":"char.kaguya_houraisan","facet":"spark","delta":1},{"op":"relationship","character_id":"char.fujiwara_no_mokou","facet":"respect","delta":1},{"op":"set_flag","key":"flag.route.kaguya.rivalry_rule_chosen","value":true}],"next":"n_playful_line"},"n_patient":{"type":"effects","effects":[{"op":"relationship","character_id":"char.kaguya_houraisan","facet":"ease","delta":1},{"op":"relationship","character_id":"char.fujiwara_no_mokou","facet":"ease","delta":1},{"op":"set_flag","key":"flag.route.kaguya.warning_heard_without_defense","value":true}],"next":"n_patient_line"},"n_defiant":{"type":"effects","effects":[{"op":"relationship","character_id":"char.kaguya_houraisan","facet":"respect","delta":1},{"op":"relationship","character_id":"char.fujiwara_no_mokou","facet":"respect","delta":1},{"op":"set_flag","key":"flag.route.kaguya.not_prize_of_immortal_feud","value":true}],"next":"n_defiant_line"},"n_direct_line":{"type":"line","beat_id":"beat.ein.mokou_uninvited_honesty.direct","next":"n_after"},"n_playful_line":{"type":"line","beat_id":"beat.ein.mokou_uninvited_honesty.playful","next":"n_after"},"n_patient_line":{"type":"line","beat_id":"beat.ein.mokou_uninvited_honesty.patient","next":"n_after"},"n_defiant_line":{"type":"line","beat_id":"beat.ein.mokou_uninvited_honesty.defiant","next":"n_after"},"n_after":{"type":"line","beat_id":"beat.ein.mokou_uninvited_honesty.after","next":"n_journal"},"n_journal":{"type":"journal_entry","entry_id":"journal.ein.mokou_uninvited_honesty","entry_type":"route_observation","tags":["immortal_rivalry","no_ownership","third_party_agency"],"next":"n_effects"},"n_effects":{"type":"effects","effects":[{"op":"route_stage","character_id":"char.kaguya_houraisan","stage":5},{"op":"set_flag","key":"flag.route.kaguya.rivalry_heard_without_ownership","value":true},{"op":"set_flag","key":"evt.ein.mokou_uninvited_honesty.complete","value":true}],"next":"n_end"},"n_end":{"type":"end_event","outcome":"immortal_rivalry_named_without_claiming_anyone"}},"origin_tags":{"canon":4,"fanon":0,"original":10},"comfort_tags":["no_timer","conflict_discussion","no_coercive_romance"]}
