{"schema_version":1,"id":"evt.hgy.two_bodies_one_embarrassment","title_key":"event.hgy.two_bodies.title","location_id":"loc.hakugyokurou","spot_id":"loc.hakugyokurou.narrow_bridge","cast":["char.youmu_konpaku"],"availability":[{"predicate":"chapter_at_least","value":"chapter.1"},{"predicate":"event_completed","value":"evt.hgy.garden_shift"},{"predicate":"flag_false","key":"evt.hgy.two_bodies_one_embarrassment.complete"}],"entry_node":"n001","nodes":{"n001":{"type":"music_state","state":"mus_youmu_training","next":"n003"},"n002":{"type":"exploration_objective","objective_key":"obj.hgy.two_bodies.cross","interactable_ids":["prop.hgy.bridge_human_mark","prop.hgy.bridge_phantom_mark"],"next":"n005"},"n003":{"type":"line","beat_id":"beat.hgy.two_bodies.intro","next":"n004"},"n004":{"type":"line","beat_id":"beat.hgy.two_bodies.explain","next":"n002"},"n005":{"type":"choice","choice_id":"choice.hgy.two_bodies.response","options":[{"tone":"direct","text_key":"choice.hgy.two_bodies.direct","next":"n_direct"},{"tone":"playful","text_key":"choice.hgy.two_bodies.playful","next":"n_playful"},{"tone":"patient","text_key":"choice.hgy.two_bodies.patient","next":"n_patient"},{"tone":"defiant","text_key":"choice.hgy.two_bodies.defiant","next":"n_defiant"}]},"n_direct":{"type":"effects","effects":[{"op":"relationship","character_id":"char.youmu_konpaku","facet":"respect","delta":1}],"next":"n_direct_line"},"n_playful":{"type":"effects","effects":[{"op":"relationship","character_id":"char.youmu_konpaku","facet":"spark","delta":1}],"next":"n_playful_line"},"n_patient":{"type":"effects","effects":[{"op":"relationship","character_id":"char.youmu_konpaku","facet":"ease","delta":1}],"next":"n_patient_line"},"n_defiant":{"type":"effects","effects":[{"op":"relationship","character_id":"char.youmu_konpaku","facet":"respect","delta":1},{"op":"relationship","character_id":"char.youmu_konpaku","facet":"strain","delta":1}],"next":"n_defiant_line"},"n_direct_line":{"type":"line","beat_id":"beat.hgy.two_bodies.direct","next":"n_balance"},"n_playful_line":{"type":"line","beat_id":"beat.hgy.two_bodies.playful","next":"n_balance"},"n_patient_line":{"type":"line","beat_id":"beat.hgy.two_bodies.patient","next":"n_balance"},"n_defiant_line":{"type":"line","beat_id":"beat.hgy.two_bodies.defiant","next":"n_balance"},"n_balance":{"type":"start_minigame","minigame_id":"mini.hgy.half_phantom_balance","result_branches":{"clear":"n_clear","withdrawn":"n_withdrawn"}},"n_clear":{"type":"line","beat_id":"beat.hgy.two_bodies.clear","next":"n_journal_clear"},"n_withdrawn":{"type":"line","beat_id":"beat.hgy.two_bodies.withdrawn","next":"n_journal_withdrawn"},"n_journal_clear":{"type":"journal_entry","entry_id":"journal.hgy.two_bodies","entry_type":"route_observation","tags":["paired_bodies","crossing_without_correction"],"next":"n_after_music"},"n_journal_withdrawn":{"type":"journal_entry","entry_id":"journal.hgy.two_bodies.withdrawn","entry_type":"route_observation","tags":["paired_bodies","pause_without_shame"],"next":"n_after_music"},"n_after_music":{"type":"music_state","state":"mus_youmu_afterbeat","next":"n_after"},"n_after":{"type":"line","beat_id":"beat.hgy.two_bodies.after","next":"n_effects"},"n_effects":{"type":"effects","effects":[{"op":"route_stage","character_id":"char.youmu_konpaku","stage":2},{"op":"set_flag","key":"flag.route.youmu.two_bodies_witnessed","value":true},{"op":"set_flag","key":"evt.hgy.two_bodies_one_embarrassment.complete","value":true}],"next":"n_end"},"n_end":{"type":"end_event","outcome":"two_bodies_crossed_by_permission"}},"origin_tags":{"canon":3,"fanon":0,"original":11},"comfort_tags":["no_timer","withdrawal_continues","no_body_shame"]}
