{"schema_version":1,"id":"evt.sne.shrine_between_homes","title_key":"event.sne.shrine_between_homes.title","location_id":"loc.moriya_shrine","spot_id":"loc.moriya_shrine.private_residence_threshold","cast":["char.sanae_kochiya"],"availability":[{"predicate":"chapter_at_least","value":"chapter.1"},{"predicate":"event_completed","value":"evt.sne.outside_world_shorthand"},{"predicate":"flag_false","key":"evt.sne.shrine_between_homes.complete"}],"entry_node":"n001","nodes":{"n001":{"type":"music_state","state":"mus_sanae_route","next":"n003"},"n002":{"type":"exploration_objective","objective_key":"obj.sne.shrine_between_homes.inspect","interactable_ids":["prop.sne.old_unlabelled_key","prop.sne.current_threshold_repair_list"],"next":"n005"},"n003":{"type":"line","beat_id":"beat.sne.shrine_between_homes.key","next":"n004"},"n004":{"type":"line","beat_id":"beat.sne.shrine_between_homes.address","next":"n002"},"n005":{"type":"choice","choice_id":"choice.sne.shrine_between_homes.response","options":[{"tone":"direct","text_key":"choice.sne.shrine_between_homes.direct","next":"n_direct"},{"tone":"playful","text_key":"choice.sne.shrine_between_homes.playful","next":"n_playful"},{"tone":"patient","text_key":"choice.sne.shrine_between_homes.patient","next":"n_patient"},{"tone":"defiant","text_key":"choice.sne.shrine_between_homes.defiant","next":"n_defiant"}]},"n_direct":{"type":"effects","effects":[{"op":"relationship","character_id":"char.sanae_kochiya","facet":"trust","delta":1},{"op":"set_flag","key":"flag.route.sanae.homes.no_ranking_required","value":true}],"next":"n_direct_line"},"n_playful":{"type":"effects","effects":[{"op":"relationship","character_id":"char.sanae_kochiya","facet":"ease","delta":1},{"op":"set_flag","key":"flag.route.sanae.homes.key_not_relic","value":true}],"next":"n_playful_line"},"n_patient":{"type":"effects","effects":[{"op":"relationship","character_id":"char.sanae_kochiya","facet":"ease","delta":1},{"op":"set_flag","key":"flag.route.sanae.homes.silence_allowed","value":true}],"next":"n_patient_line"},"n_defiant":{"type":"effects","effects":[{"op":"relationship","character_id":"char.sanae_kochiya","facet":"respect","delta":1},{"op":"set_flag","key":"flag.route.sanae.homes.present_not_waiting_room","value":true}],"next":"n_defiant_line"},"n_direct_line":{"type":"line","beat_id":"beat.sne.shrine_between_homes.direct","next":"n_after_01"},"n_playful_line":{"type":"line","beat_id":"beat.sne.shrine_between_homes.playful","next":"n_after_01"},"n_patient_line":{"type":"line","beat_id":"beat.sne.shrine_between_homes.patient","next":"n_after_01"},"n_defiant_line":{"type":"line","beat_id":"beat.sne.shrine_between_homes.defiant","next":"n_after_01"},"n_after_01":{"type":"line","beat_id":"beat.sne.shrine_between_homes.after_repair","next":"n_after_02"},"n_after_02":{"type":"line","beat_id":"beat.sne.shrine_between_homes.after_key","next":"n_journal"},"n_journal":{"type":"journal_entry","entry_id":"journal.sne.shrine_between_homes","entry_type":"route_observation","tags":["two_homes_not_ranked","old_key_kept_ordinary","present_room_repaired","homesickness_not_identity"],"next":"n_effects"},"n_effects":{"type":"effects","effects":[{"op":"route_stage","character_id":"char.sanae_kochiya","stage":3},{"op":"set_flag","key":"flag.route.sanae.homes.two_truths_kept","value":true},{"op":"set_flag","key":"flag.route.sanae.homes.present_threshold_repaired","value":true},{"op":"set_flag","key":"evt.sne.shrine_between_homes.complete","value":true}],"next":"n_end"},"n_end":{"type":"end_event","outcome":"two_homes_remain_true_while_the_present_room_is_repaired"}},"origin_tags":{"canon":3,"fanon":0,"original":10},"comfort_tags":["no_timer","no_failure","homesickness_not_erasure","no_forced_disclosure"]}
