{"schema_version":1,"id":"evt.sdm.small_chair","title_key":"event.sdm.small_chair.title","location_id":"loc.scarlet_devil_mansion","spot_id":"loc.scarlet_devil_mansion.throne_recess","cast":["char.remilia_scarlet"],"availability":[{"predicate":"chapter_at_least","value":"chapter.1"},{"predicate":"event_completed","value":"evt.rml.red_mist_etiquette"},{"predicate":"flag_false","key":"evt.sdm.small_chair.complete"}],"entry_node":"n001","nodes":{"n001":{"type":"music_state","state":"mus_remilia_route","next":"n003"},"n002":{"type":"exploration_objective","objective_key":"obj.sdm.small_chair.enter_by_invitation","interactable_ids":["prop.rml.throne_backstage_curtain","prop.rml.small_resting_chair"],"next":"n005"},"n003":{"type":"line","beat_id":"beat.sdm.small_chair.invitation","next":"n004"},"n004":{"type":"line","beat_id":"beat.sdm.small_chair.private_seat","next":"n002"},"n005":{"type":"choice","choice_id":"choice.sdm.small_chair.response","options":[{"tone":"direct","text_key":"choice.sdm.small_chair.direct","next":"n_direct"},{"tone":"playful","text_key":"choice.sdm.small_chair.playful","next":"n_playful"},{"tone":"patient","text_key":"choice.sdm.small_chair.patient","next":"n_patient"},{"tone":"defiant","text_key":"choice.sdm.small_chair.defiant","next":"n_defiant"}]},"n_direct":{"type":"effects","effects":[{"op":"relationship","character_id":"char.remilia_scarlet","facet":"respect","delta":1}],"next":"n_direct_line"},"n_playful":{"type":"effects","effects":[{"op":"relationship","character_id":"char.remilia_scarlet","facet":"spark","delta":1}],"next":"n_playful_line"},"n_patient":{"type":"effects","effects":[{"op":"relationship","character_id":"char.remilia_scarlet","facet":"ease","delta":1},{"op":"set_flag","key":"flag.route.remilia.small_chair.waited_for_invitation","value":true}],"next":"n_patient_line"},"n_defiant":{"type":"effects","effects":[{"op":"relationship","character_id":"char.remilia_scarlet","facet":"respect","delta":1},{"op":"set_flag","key":"flag.route.remilia.small_chair.office_not_body","value":true}],"next":"n_defiant_line"},"n_direct_line":{"type":"line","beat_id":"beat.sdm.small_chair.direct","next":"n_after"},"n_playful_line":{"type":"line","beat_id":"beat.sdm.small_chair.playful","next":"n_after"},"n_patient_line":{"type":"line","beat_id":"beat.sdm.small_chair.patient","next":"n_after"},"n_defiant_line":{"type":"line","beat_id":"beat.sdm.small_chair.defiant","next":"n_after"},"n_after":{"type":"line","beat_id":"beat.sdm.small_chair.after","next":"n_journal"},"n_journal":{"type":"journal_entry","entry_id":"journal.sdm.small_chair","entry_type":"route_observation","tags":["private_access_invited","rest_not_childish","office_not_body"],"next":"n_effects"},"n_effects":{"type":"effects","effects":[{"op":"route_stage","character_id":"char.remilia_scarlet","stage":3},{"op":"set_flag","key":"flag.route.remilia.small_chair.private_access_invited","value":true},{"op":"set_flag","key":"evt.sdm.small_chair.complete","value":true}],"next":"n_end"},"n_end":{"type":"end_event","outcome":"private_rest_shared_without_becoming_exhibit"}},"origin_tags":{"canon":3,"fanon":0,"original":10},"comfort_tags":["no_timer","no_failure","private_access_invited","no_infantilization"]}
