{"schema_version":1,"id":"evt.aya.tomorrows_front_page","title_key":"event.aya.tomorrows_front_page.title","location_id":"loc.youkai_mountain","spot_id":"loc.youkai_mountain.wind_ridge","cast":["char.aya_shameimaru"],"availability":[{"predicate":"chapter_at_least","value":"chapter.1"},{"predicate":"event_completed","value":"evt.aya.camera_down"},{"predicate":"flag_false","key":"evt.aya.tomorrows_front_page.complete"}],"entry_node":"n001","nodes":{"n001":{"type":"music_state","state":"mus_aya_afterbeat","next":"n003"},"n002":{"type":"exploration_objective","objective_key":"obj.aya.tomorrows_front_page.withhold","interactable_ids":["prop.aya.archive_front_page","prop.aya.unprinted_morning"],"next":"n005"},"n003":{"type":"line","beat_id":"beat.aya.tomorrows_front_page.offer","next":"n004"},"n004":{"type":"line","beat_id":"beat.aya.tomorrows_front_page.refusal","next":"n002"},"n005":{"type":"choice","choice_id":"choice.aya.tomorrows_front_page.response","options":[{"tone":"direct","text_key":"choice.aya.tomorrows_front_page.direct","next":"n_direct"},{"tone":"playful","text_key":"choice.aya.tomorrows_front_page.playful","next":"n_playful"},{"tone":"patient","text_key":"choice.aya.tomorrows_front_page.patient","next":"n_patient"},{"tone":"defiant","text_key":"choice.aya.tomorrows_front_page.defiant","next":"n_defiant"}]},"n_direct":{"type":"effects","effects":[{"op":"relationship","character_id":"char.aya_shameimaru","facet":"respect","delta":1}],"next":"n_direct_line"},"n_playful":{"type":"effects","effects":[{"op":"relationship","character_id":"char.aya_shameimaru","facet":"spark","delta":1}],"next":"n_playful_line"},"n_patient":{"type":"effects","effects":[{"op":"relationship","character_id":"char.aya_shameimaru","facet":"ease","delta":1}],"next":"n_patient_line"},"n_defiant":{"type":"effects","effects":[{"op":"relationship","character_id":"char.aya_shameimaru","facet":"respect","delta":1},{"op":"relationship","character_id":"char.aya_shameimaru","facet":"strain","delta":1}],"next":"n_defiant_line"},"n_direct_line":{"type":"line","beat_id":"beat.aya.tomorrows_front_page.direct","next":"n_after"},"n_playful_line":{"type":"line","beat_id":"beat.aya.tomorrows_front_page.playful","next":"n_after"},"n_patient_line":{"type":"line","beat_id":"beat.aya.tomorrows_front_page.patient","next":"n_after"},"n_defiant_line":{"type":"line","beat_id":"beat.aya.tomorrows_front_page.defiant","next":"n_after"},"n_after":{"type":"line","beat_id":"beat.aya.tomorrows_front_page.after","next":"n_journal"},"n_journal":{"type":"journal_entry","entry_id":"journal.aya.tomorrows_front_page","entry_type":"route_observation","tags":["archive_refusal","future_withheld","uncertainty_preserved"],"next":"n_effects"},"n_effects":{"type":"effects","effects":[{"op":"route_stage","character_id":"char.aya_shameimaru","stage":6},{"op":"set_flag","key":"flag.route.aya.perfect_headline_withheld","value":true},{"op":"set_flag","key":"evt.aya.tomorrows_front_page.complete","value":true}],"next":"n_end"},"n_end":{"type":"end_event","outcome":"perfect_future_headline_withheld_before_it_can_be_performed"}},"origin_tags":{"canon":3,"fanon":0,"original":10},"comfort_tags":["no_timer","archive_refusal","uncertainty_preserved"]}
