{
  "schema_version": 1,
  "id": "evt.hkr.empty_cushion",
  "title_key": "event.hkr.empty_cushion.title",
  "location_id": "loc.hakurei_shrine",
  "spot_id": "loc.hakurei_shrine.veranda",
  "cast": [
    "char.reimu_hakurei",
    "char.marisa_kirisame"
  ],
  "availability": [
    {
      "predicate": "chapter_at_least",
      "value": "chapter.1"
    },
    {
      "predicate": "flag_false",
      "key": "evt.hkr.empty_cushion.complete"
    },
    {
      "predicate": "time_in",
      "values": [
        "day",
        "dusk"
      ]
    }
  ],
  "entry_node": "n001",
  "nodes": {
    "n001": {
      "type": "music_state",
      "state": "mus_shrine_day",
      "next": "n002"
    },
    "n002": {
      "type": "exploration_objective",
      "objective_key": "obj.hkr.find_second_cup",
      "interactable_ids": [
        "prop.unpaired_cup",
        "prop.empty_cushion"
      ],
      "next": "n003"
    },
    "n003": {
      "type": "line",
      "beat_id": "beat.hkr.empty_cushion.reimu.001",
      "next": "n004"
    },
    "n004": {
      "type": "choice",
      "choice_id": "choice.hkr.empty_cushion.01",
      "options": [
        {
          "tone": "direct",
          "text_key": "choice.hkr.empty_cushion.direct",
          "next": "n_direct"
        },
        {
          "tone": "playful",
          "text_key": "choice.hkr.empty_cushion.playful",
          "next": "n_playful"
        },
        {
          "tone": "patient",
          "text_key": "choice.hkr.empty_cushion.patient",
          "next": "n_patient"
        },
        {
          "tone": "defiant",
          "text_key": "choice.hkr.empty_cushion.defiant",
          "next": "n_defiant"
        }
      ]
    },
    "n_direct": {
      "type": "effects",
      "effects": [
        {
          "op": "relationship",
          "character_id": "char.reimu_hakurei",
          "facet": "respect",
          "delta": 1
        }
      ],
      "next": "n_direct_line"
    },
    "n_playful": {
      "type": "effects",
      "effects": [
        {
          "op": "relationship",
          "character_id": "char.reimu_hakurei",
          "facet": "spark",
          "delta": 1
        },
        {
          "op": "relationship",
          "character_id": "char.reimu_hakurei",
          "facet": "strain",
          "delta": 1
        }
      ],
      "next": "n_playful_line"
    },
    "n_patient": {
      "type": "effects",
      "effects": [
        {
          "op": "relationship",
          "character_id": "char.reimu_hakurei",
          "facet": "ease",
          "delta": 1
        },
        {
          "op": "relationship",
          "character_id": "char.reimu_hakurei",
          "facet": "trust",
          "delta": 1
        }
      ],
      "next": "n_patient_line"
    },
    "n_defiant": {
      "type": "effects",
      "effects": [
        {
          "op": "relationship",
          "character_id": "char.reimu_hakurei",
          "facet": "respect",
          "delta": 1
        },
        {
          "op": "relationship",
          "character_id": "char.reimu_hakurei",
          "facet": "strain",
          "delta": 1
        }
      ],
      "next": "n_defiant_line"
    },
    "n_direct_line": {
      "type": "line",
      "beat_id": "beat.hkr.empty_cushion.reimu.direct",
      "next": "n005"
    },
    "n_playful_line": {
      "type": "line",
      "beat_id": "beat.hkr.empty_cushion.reimu.playful",
      "next": "n005"
    },
    "n_patient_line": {
      "type": "line",
      "beat_id": "beat.hkr.empty_cushion.reimu.patient",
      "next": "n005"
    },
    "n_defiant_line": {
      "type": "line",
      "beat_id": "beat.hkr.empty_cushion.reimu.defiant",
      "next": "n005"
    },
    "n005": {
      "type": "start_minigame",
      "minigame_id": "mini.shrine.tea_temperature",
      "context": {
        "target_band": "warm",
        "cups": 2
      },
      "result_branches": {
        "excellent": "n006a",
        "clear": "n006b",
        "loss": "n006c"
      }
    },
    "n006a": {
      "type": "line",
      "beat_id": "beat.hkr.empty_cushion.reimu.excellent",
      "next": "n006d"
    },
    "n006b": {
      "type": "line",
      "beat_id": "beat.hkr.empty_cushion.reimu.clear",
      "next": "n006d"
    },
    "n006c": {
      "type": "line",
      "beat_id": "beat.hkr.empty_cushion.reimu.loss",
      "next": "n006d"
    },
    "n006d": {
      "type": "line",
      "beat_id": "beat.hkr.empty_cushion.reimu.stain",
      "next": "n006e"
    },
    "n006e": {
      "type": "music_state",
      "state": "mus_border_crossing",
      "next": "n007"
    },
    "n007": {
      "type": "start_danmaku",
      "minigame_id": "danmaku.hkr.boundary_stain",
      "result_branches": {
        "clear": "n007a",
        "assist_clear": "n007b",
        "loss": "n007c"
      }
    },
    "n007a": {
      "type": "line",
      "beat_id": "beat.hkr.empty_cushion.reimu.danmaku_clear",
      "next": "n007d"
    },
    "n007b": {
      "type": "line",
      "beat_id": "beat.hkr.empty_cushion.reimu.danmaku_assist",
      "next": "n007d"
    },
    "n007c": {
      "type": "line",
      "beat_id": "beat.hkr.empty_cushion.reimu.danmaku_loss",
      "next": "n007d"
    },
    "n007d": {
      "type": "line",
      "beat_id": "beat.hkr.empty_cushion.marisa.terms_intro",
      "next": "n007e"
    },
    "n007e": {
      "type": "music_state",
      "state": "mus_shrine_duel",
      "next": "n008"
    },
    "n008": {
      "type": "start_duel",
      "minigame_id": "duel.hkr.spell_card_terms",
      "result_branches": {
        "win": "n008a",
        "loss": "n008b"
      }
    },
    "n008a": {
      "type": "line",
      "beat_id": "beat.hkr.empty_cushion.reimu.duel_win",
      "next": "n009"
    },
    "n008b": {
      "type": "line",
      "beat_id": "beat.hkr.empty_cushion.reimu.duel_loss",
      "next": "n009"
    },
    "n009": {
      "type": "music_state",
      "state": "mus_reimu_private",
      "next": "n_afterbeat_01"
    },
    "n_afterbeat_01": {
      "type": "line",
      "beat_id": "beat.hkr.empty_cushion.reimu.afterbeat_01",
      "next": "n_afterbeat_02"
    },
    "n_afterbeat_02": {
      "type": "line",
      "beat_id": "beat.hkr.empty_cushion.reimu.afterbeat_02",
      "next": "n_afterbeat_03"
    },
    "n_afterbeat_03": {
      "type": "line",
      "beat_id": "beat.hkr.empty_cushion.reimu.afterbeat_03",
      "next": "n_afterbeat_04"
    },
    "n_afterbeat_04": {
      "type": "line",
      "beat_id": "beat.hkr.empty_cushion.reimu.afterbeat_04",
      "next": "n_give_keepsake"
    },
    "n_give_keepsake": {
      "type": "give_item",
      "item_id": "item.keepsake.unpaired_cup",
      "next": "n_add_journal"
    },
    "n_add_journal": {
      "type": "journal_entry",
      "entry_id": "journal.hkr.empty_cushion",
      "next": "n_complete_effects"
    },
    "n_complete_effects": {
      "type": "effects",
      "effects": [
        {
          "op": "set_flag",
          "key": "evt.hkr.empty_cushion.complete",
          "value": true
        }
      ],
      "next": "n010"
    },
    "n010": {
      "type": "end_event",
      "outcome": "complete"
    }
  },
  "origin_tags": {
    "canon": 1,
    "fanon": 0,
    "original": 9
  },
  "comfort_tags": [
    "no_timer",
    "assist_available",
    "loss_continues",
    "spell_terms_explicit",
    "choice_tones_remain_distinct"
  ]
}
