{"schema_version":1,"id":"evt.eir.permanent_cure","title_key":"event.eir.permanent_cure.title","location_id":"loc.eientei","spot_id":"loc.eientei.permanent_cure_audit_table","cast":["char.eirin_yagokoro","char.kaguya_houraisan","char.reisen_udongein_inaba"],"availability":[{"predicate":"chapter_at_least","value":"chapter.1"},{"predicate":"event_completed","value":"evt.eir.doctor_sleeps"},{"predicate":"flag_true","key":"flag.route.eirin.rest.boundary_strain_repaired_through_practice"},{"predicate":"flag_false","key":"evt.eir.permanent_cure.complete"}],"entry_node":"n001","nodes":{"n001":{"type":"music_state","state":"mus_eirin_route","next":"n_offer"},"n_offer":{"type":"line","beat_id":"beat.eir.permanent_cure.offer","next":"n_audit"},"n_audit":{"type":"line","beat_id":"beat.eir.permanent_cure.audit","next":"n_zero_mapping"},"n_zero_mapping":{"type":"line","beat_id":"beat.eir.permanent_cure.zero_mapping","next":"n_checksum"},"n_checksum":{"type":"line","beat_id":"beat.eir.permanent_cure.checksum","next":"n_kaguya"},"n_kaguya":{"type":"line","beat_id":"beat.eir.permanent_cure.kaguya","next":"n_cost"},"n_cost":{"type":"line","beat_id":"beat.eir.permanent_cure.cost","next":"n_objective"},"n_objective":{"type":"exploration_objective","objective_key":"obj.eir.permanent_cure.audit","interactable_ids":["prop.eir.archive_three_zero_offer","prop.eir.disappearing_consent_field","prop.eir.fixed_patient_checksum","prop.eir.blank_revision_line"],"next":"n_reject"},"n_reject":{"type":"line","beat_id":"beat.eir.permanent_cure.reject","next":"n_reject_effects"},"n_reject_effects":{"type":"effects","effects":[{"op":"set_flag","key":"flag.route.eirin.cure.permanent_cure_rejected_by_eirin","value":true}],"next":"n_choice"},"n_choice":{"type":"choice","choice_id":"choice.eir.permanent_cure.record","options":[{"tone":"direct","text_key":"choice.eir.permanent_cure.direct","next":"n_direct"},{"tone":"playful","text_key":"choice.eir.permanent_cure.playful","next":"n_playful"},{"tone":"patient","text_key":"choice.eir.permanent_cure.patient","next":"n_patient"},{"tone":"defiant","text_key":"choice.eir.permanent_cure.defiant","next":"n_defiant"}]},"n_direct":{"type":"effects","effects":[{"op":"relationship","character_id":"char.eirin_yagokoro","facet":"respect","delta":1},{"op":"set_flag","key":"flag.route.eirin.cure.beneficiary_absent_named","value":true}],"next":"n_direct_line"},"n_playful":{"type":"effects","effects":[{"op":"relationship","character_id":"char.eirin_yagokoro","facet":"ease","delta":1},{"op":"set_flag","key":"flag.route.eirin.cure.perfect_chart_not_patient","value":true}],"next":"n_playful_line"},"n_patient":{"type":"effects","effects":[{"op":"relationship","character_id":"char.eirin_yagokoro","facet":"trust","delta":1},{"op":"set_flag","key":"flag.route.eirin.cure.living_revision_preserved","value":true}],"next":"n_patient_line"},"n_defiant":{"type":"effects","effects":[{"op":"relationship","character_id":"char.eirin_yagokoro","facet":"respect","delta":1},{"op":"set_flag","key":"flag.route.eirin.cure.erasing_premise_rejected","value":true}],"next":"n_defiant_line"},"n_direct_line":{"type":"line","beat_id":"beat.eir.permanent_cure.direct","next":"n_after"},"n_playful_line":{"type":"line","beat_id":"beat.eir.permanent_cure.playful","next":"n_after"},"n_patient_line":{"type":"line","beat_id":"beat.eir.permanent_cure.patient","next":"n_after"},"n_defiant_line":{"type":"line","beat_id":"beat.eir.permanent_cure.defiant","next":"n_after"},"n_after":{"type":"line","beat_id":"beat.eir.permanent_cure.after","next":"n_close"},"n_close":{"type":"line","beat_id":"beat.eir.permanent_cure.close","next":"n_revision"},"n_revision":{"type":"line","beat_id":"beat.eir.permanent_cure.revision","next":"n_journal"},"n_journal":{"type":"journal_entry","entry_id":"journal.eir.permanent_cure","entry_type":"route_observation","tags":["permanent_cure_rejected_by_eirin","patient_presence_required","mortality_not_failure","uncertainty_preserved","diagnosis_remains_revisable","no_sample_or_procedure"],"next":"n_effects"},"n_effects":{"type":"effects","effects":[{"op":"route_stage","character_id":"char.eirin_yagokoro","stage":6},{"op":"set_flag","key":"flag.route.eirin.cure.patient_presence_required","value":true},{"op":"set_flag","key":"flag.route.eirin.cure.mortality_not_failure","value":true},{"op":"set_flag","key":"flag.route.eirin.cure.uncertainty_preserved","value":true},{"op":"set_flag","key":"flag.route.eirin.cure.diagnosis_remains_revisable","value":true},{"op":"set_flag","key":"flag.route.eirin.cure.no_sample_or_procedure","value":true},{"op":"set_flag","key":"evt.eir.permanent_cure.complete","value":true}],"next":"n_end"},"n_end":{"type":"end_event","outcome":"permanent_cure_rejected_patient_and_revision_remain"}},"origin_tags":{"canon":3,"fanon":0,"original":20},"comfort_tags":["no_timer","no_failure","archive_refusal","patient_not_metric","mortality_not_failure","no_immortality_procedure","no_real_world_treatment_advice"]}
