{"schema_version":1,"id":"evt.aya.hidden_folder","title_key":"event.aya.hidden_folder.title","location_id":"loc.youkai_mountain","spot_id":"loc.youkai_mountain.bunbunmaru_darkroom","cast":["char.aya_shameimaru"],"availability":[{"predicate":"chapter_at_least","value":"chapter.1"},{"predicate":"event_completed","value":"evt.aya.wind_frame_graze"},{"predicate":"flag_false","key":"evt.aya.hidden_folder.complete"}],"entry_node":"n001","nodes":{"n001":{"type":"music_state","state":"mus_aya_afterbeat","next":"n003"},"n002":{"type":"exploration_objective","objective_key":"obj.aya.hidden_folder.review","interactable_ids":["prop.aya.unprinted_folder","prop.aya.mended_rope"],"next":"n005"},"n003":{"type":"line","beat_id":"beat.aya.hidden_folder.intro","next":"n004"},"n004":{"type":"line","beat_id":"beat.aya.hidden_folder.record","next":"n002"},"n005":{"type":"choice","choice_id":"choice.aya.hidden_folder.response","options":[{"tone":"direct","text_key":"choice.aya.hidden_folder.direct","next":"n_direct"},{"tone":"playful","text_key":"choice.aya.hidden_folder.playful","next":"n_playful"},{"tone":"patient","text_key":"choice.aya.hidden_folder.patient","next":"n_patient"},{"tone":"defiant","text_key":"choice.aya.hidden_folder.defiant","next":"n_defiant"}]},"n_direct":{"type":"effects","effects":[{"op":"relationship","character_id":"char.aya_shameimaru","facet":"respect","delta":1}],"next":"n_direct_line"},"n_playful":{"type":"effects","effects":[{"op":"relationship","character_id":"char.aya_shameimaru","facet":"spark","delta":1}],"next":"n_playful_line"},"n_patient":{"type":"effects","effects":[{"op":"relationship","character_id":"char.aya_shameimaru","facet":"ease","delta":1}],"next":"n_patient_line"},"n_defiant":{"type":"effects","effects":[{"op":"relationship","character_id":"char.aya_shameimaru","facet":"respect","delta":1},{"op":"relationship","character_id":"char.aya_shameimaru","facet":"strain","delta":1}],"next":"n_defiant_line"},"n_direct_line":{"type":"line","beat_id":"beat.aya.hidden_folder.direct","next":"n_after"},"n_playful_line":{"type":"line","beat_id":"beat.aya.hidden_folder.playful","next":"n_after"},"n_patient_line":{"type":"line","beat_id":"beat.aya.hidden_folder.patient","next":"n_after"},"n_defiant_line":{"type":"line","beat_id":"beat.aya.hidden_folder.defiant","next":"n_after"},"n_after":{"type":"line","beat_id":"beat.aya.hidden_folder.after","next":"n_journal"},"n_journal":{"type":"journal_entry","entry_id":"journal.aya.hidden_folder","entry_type":"route_observation","tags":["intervention_record","privacy_respected","accountability"],"next":"n_effects"},"n_effects":{"type":"effects","effects":[{"op":"route_stage","character_id":"char.aya_shameimaru","stage":3},{"op":"set_flag","key":"flag.route.aya.interventions_recorded_without_exposure","value":true},{"op":"set_flag","key":"evt.aya.hidden_folder.complete","value":true}],"next":"n_end"},"n_end":{"type":"end_event","outcome":"intervention_record_kept_without_a_headline"}},"origin_tags":{"canon":3,"fanon":0,"original":10},"comfort_tags":["no_timer","privacy_respected","accountability_without_exposure"]}
