{"schema_version":1,"id":"evt.mrs.crash_landing","title_key":"event.mrs.crash_landing.title","location_id":"loc.forest_of_magic","spot_id":"loc.forest_of_magic.forest_edge","cast":["char.marisa_kirisame"],"availability":[{"predicate":"chapter_at_least","value":"chapter.1"},{"predicate":"flag_false","key":"evt.mrs.crash_landing.complete"}],"entry_node":"n001","nodes":{"n001":{"type":"music_state","state":"mus_marisa_arrival","next":"n002"},"n002":{"type":"exploration_objective","objective_key":"obj.mrs.crash.secure_cargo","interactable_ids":["prop.marisa_cargo","prop.marisa_broom"],"next":"n003"},"n003":{"type":"line","beat_id":"beat.mrs.crash.intro","next":"n004"},"n004":{"type":"line","beat_id":"beat.mrs.crash.work","next":"n005"},"n005":{"type":"choice","choice_id":"choice.mrs.crash.response","options":[{"tone":"direct","text_key":"choice.mrs.crash.direct","next":"n_direct"},{"tone":"playful","text_key":"choice.mrs.crash.playful","next":"n_playful"},{"tone":"patient","text_key":"choice.mrs.crash.patient","next":"n_patient"},{"tone":"defiant","text_key":"choice.mrs.crash.defiant","next":"n_defiant"}]},"n_direct":{"type":"effects","effects":[{"op":"relationship","character_id":"char.marisa_kirisame","facet":"respect","delta":1}],"next":"n_direct_line"},"n_playful":{"type":"effects","effects":[{"op":"relationship","character_id":"char.marisa_kirisame","facet":"spark","delta":1}],"next":"n_playful_line"},"n_patient":{"type":"effects","effects":[{"op":"relationship","character_id":"char.marisa_kirisame","facet":"ease","delta":1}],"next":"n_patient_line"},"n_defiant":{"type":"effects","effects":[{"op":"relationship","character_id":"char.marisa_kirisame","facet":"respect","delta":1},{"op":"relationship","character_id":"char.marisa_kirisame","facet":"strain","delta":1}],"next":"n_defiant_line"},"n_direct_line":{"type":"line","beat_id":"beat.mrs.crash.direct","next":"n_broom"},"n_playful_line":{"type":"line","beat_id":"beat.mrs.crash.playful","next":"n_broom"},"n_patient_line":{"type":"line","beat_id":"beat.mrs.crash.patient","next":"n_broom"},"n_defiant_line":{"type":"line","beat_id":"beat.mrs.crash.defiant","next":"n_broom"},"n_broom":{"type":"start_minigame","minigame_id":"mini.mrs.broom_backseat","result_branches":{"clear":"n_clear","assist_clear":"n_rough"}},"n_clear":{"type":"line","beat_id":"beat.mrs.crash.clear","next":"n_after"},"n_rough":{"type":"line","beat_id":"beat.mrs.crash.rough","next":"n_after"},"n_after":{"type":"line","beat_id":"beat.mrs.crash.after","next":"n_journal"},"n_journal":{"type":"journal_entry","entry_id":"journal.mrs.crash_landing","entry_type":"route_observation","tags":["cargo_returned","records_kept","return_before_borrowing"],"next":"n_effects"},"n_effects":{"type":"effects","effects":[{"op":"route_stage","character_id":"char.marisa_kirisame","stage":1},{"op":"set_flag","key":"flag.route.marisa.returned_object_first","value":true},{"op":"set_flag","key":"evt.mrs.crash_landing.complete","value":true}],"next":"n_end"},"n_end":{"type":"end_event","outcome":"cargo_landed_and_return_kept"}},"origin_tags":{"canon":2,"fanon":1,"original":11},"comfort_tags":["no_timer","rough_landing_continues","wider_timing"]}
