{"schema_version":1,"id":"evt.sne.faith_festival_planner","title_key":"event.sne.faith_festival_planner.title","location_id":"loc.moriya_shrine","spot_id":"loc.moriya_shrine.festival_planning_platform","cast":["char.sanae_kochiya","char.kanako_yasaka","char.suwako_moriya"],"availability":[{"predicate":"chapter_at_least","value":"chapter.1"},{"predicate":"flag_false","key":"evt.sne.faith_festival_planner.complete"}],"entry_node":"n001","nodes":{"n001":{"type":"music_state","state":"mus_sanae_route","next":"n003"},"n002":{"type":"exploration_objective","objective_key":"obj.sne.faith_festival_planner.compare","interactable_ids":["prop.sne.festival_safety_lane","prop.sne.quiet_prayer_board","prop.sne.single_miracle_schedule"],"next":"n005"},"n003":{"type":"line","beat_id":"beat.sne.faith_festival_planner.sanae_plan","next":"n004"},"n004":{"type":"line","beat_id":"beat.sne.faith_festival_planner.kanako_condition","next":"n006"},"n006":{"type":"line","beat_id":"beat.sne.faith_festival_planner.suwako_condition","next":"n002"},"n005":{"type":"choice","choice_id":"choice.sne.faith_festival_planner.response","options":[{"tone":"direct","text_key":"choice.sne.faith_festival_planner.direct","next":"n_direct"},{"tone":"playful","text_key":"choice.sne.faith_festival_planner.playful","next":"n_playful"},{"tone":"patient","text_key":"choice.sne.faith_festival_planner.patient","next":"n_patient"},{"tone":"defiant","text_key":"choice.sne.faith_festival_planner.defiant","next":"n_defiant"}]},"n_direct":{"type":"effects","effects":[{"op":"relationship","character_id":"char.sanae_kochiya","facet":"respect","delta":1},{"op":"set_flag","key":"flag.route.sanae.festival.three_obligations_named","value":true}],"next":"n_direct_line"},"n_playful":{"type":"effects","effects":[{"op":"relationship","character_id":"char.sanae_kochiya","facet":"spark","delta":1},{"op":"set_flag","key":"flag.route.sanae.festival.spectacle_rotated_not_repeated","value":true}],"next":"n_playful_line"},"n_patient":{"type":"effects","effects":[{"op":"relationship","character_id":"char.sanae_kochiya","facet":"ease","delta":1},{"op":"set_flag","key":"flag.route.sanae.festival.unwatched_prayer_protected","value":true}],"next":"n_patient_line"},"n_defiant":{"type":"effects","effects":[{"op":"relationship","character_id":"char.sanae_kochiya","facet":"respect","delta":1},{"op":"set_flag","key":"flag.route.sanae.festival.applause_not_master_metric","value":true}],"next":"n_defiant_line"},"n_direct_line":{"type":"line","beat_id":"beat.sne.faith_festival_planner.direct","next":"n_festival"},"n_playful_line":{"type":"line","beat_id":"beat.sne.faith_festival_planner.playful","next":"n_festival"},"n_patient_line":{"type":"line","beat_id":"beat.sne.faith_festival_planner.patient","next":"n_festival"},"n_defiant_line":{"type":"line","beat_id":"beat.sne.faith_festival_planner.defiant","next":"n_festival"},"n_festival":{"type":"start_minigame","minigame_id":"mini.sne.faith_festival_planner","context":{"target_band":"spectacle_safety_sincerity_balanced","assist_allowed":true},"result_branches":{"clear":"n_clear","assist_clear":"n_assist","loss":"n_loss"}},"n_clear":{"type":"line","beat_id":"beat.sne.faith_festival_planner.clear","next":"n_after"},"n_assist":{"type":"line","beat_id":"beat.sne.faith_festival_planner.assist","next":"n_after"},"n_loss":{"type":"line","beat_id":"beat.sne.faith_festival_planner.loss","next":"n_after"},"n_after":{"type":"line","beat_id":"beat.sne.faith_festival_planner.after","next":"n_journal"},"n_journal":{"type":"journal_entry","entry_id":"journal.sne.faith_festival_planner","entry_type":"route_observation","tags":["single_witnessed_miracle","safety_lane_protected","unwatched_prayer_valid","loss_continues"],"next":"n_effects"},"n_effects":{"type":"effects","effects":[{"op":"route_stage","character_id":"char.sanae_kochiya","stage":1},{"op":"set_flag","key":"flag.route.sanae.festival.plan_authored_by_sanae","value":true},{"op":"set_flag","key":"flag.route.sanae.festival.safety_and_sincerity_non_negotiable","value":true},{"op":"set_flag","key":"evt.sne.faith_festival_planner.complete","value":true}],"next":"n_end"},"n_end":{"type":"end_event","outcome":"festival_planned_as_three_obligations_not_one_score"}},"origin_tags":{"canon":3,"fanon":0,"original":12},"comfort_tags":["no_timer","assist_available","loss_continues","safety_non_negotiable","worship_not_audience_score"]}
